root@comp3134-lamponubuntu2204-s-1vcpu-1gb-tor1-01:~# tcpdump -n -i eth0
tcpdump: verbose output suppressed, use -v[v]... for full protocol decode
listening on eth0, link-type EN10MB (Ethernet), snapshot length 262144 bytes
00:25:14.178027 IP 147.182.153.220.22 > 99.227.168.112.60334: Flags [P.], seq 1985625001:1985625109, ack 1056670245, win 501, length 108
00:25:14.178143 IP 147.182.153.220.22 > 99.227.168.112.60334: Flags [P.], seq 108:264, ack 1, win 501, length 156
00:25:14.178209 IP 147.182.153.220.22 > 99.227.168.112.60334: Flags [P.], seq 264:368, ack 1, win 501, length 104
00:25:14.205273 IP 99.227.168.112.60334 > 147.182.153.220.22: Flags [.], ack 368, win 1026, length 0
00:25:14.280556 IP 147.182.153.220.22 > 99.227.168.112.60334: Flags [P.], seq 368:540, ack 1, win 501, length 172
00:25:14.280715 IP 147.182.153.220.22 > 99.227.168.112.60334: Flags [P.], seq 540:724, ack 1, win 501, length 184
00:25:14.280827 IP 147.182.153.220.22 > 99.227.168.112.60334: Flags [P.], seq 724:760, ack 1, win 501, length 36
00:25:14.280918 IP 147.182.153.220.22 > 99.227.168.112.60334: Flags [P.], seq 760:908, ack 1, win 501, length 148
00:25:14.280984 IP 147.182.153.220.22 > 99.227.168.112.60334: Flags [P.], seq 908:944, ack 1, win 501, length 36
00:25:14.281048 IP 147.182.153.220.22 > 99.227.168.112.60334: Flags [P.], seq 944:1084, ack 1, win 501, length 140
00:25:14.281116 IP 147.182.153.220.22 > 99.227.168.112.60334: Flags [P.], seq 1084:1120, ack 1, win 501, length 36
00:25:14.293822 IP 99.227.168.112.60334 > 147.182.153.220.22: Flags [.], ack 944, win 1024, length 0
00:25:14.293823 IP 99.227.168.112.60334 > 147.182.153.220.22: Flags [.], ack 1120, win 1023, length 0
00:25:14.384379 IP 147.182.153.220.22 > 99.227.168.112.60334: Flags [P.], seq 1120:1268, ack 1, win 501, length 148
00:25:14.384470 IP 147.182.153.220.22 > 99.227.168.112.60334: Flags [P.], seq 1268:1452, ack 1, win 501, length 184
00:25:14.384532 IP 147.182.153.220.22 > 99.227.168.112.60334: Flags [P.], seq 1452:1488, ack 1, win 501, length 36
00:25:14.384584 IP 147.182.153.220.22 > 99.227.168.112.60334: Flags [P.], seq 1488:1636, ack 1, win 501, length 148
00:25:14.384625 IP 147.182.153.220.22 > 99.227.168.112.60334: Flags [P.], seq 1636:1672, ack 1, win 501, length 36
00:25:14.384693 IP 147.182.153.220.22 > 99.227.168.112.60334: Flags [P.], seq 1672:1820, ack 1, win 501, length 148
00:25:14.384745 IP 147.182.153.220.22 > 99.227.168.112.60334: Flags [P.], seq 1820:1856, ack 1, win 501, length 36
00:25:14.384842 IP 147.182.153.220.22 > 99.227.168.112.60334: Flags [P.], seq 1856:2004, ack 1, win 501, length 148
00:25:14.384900 IP 147.182.153.220.22 > 99.227.168.112.60334: Flags [P.], seq 2004:2040, ack 1, win 501, length 36
00:25:14.384970 IP 147.182.153.220.22 > 99.227.168.112.60334: Flags [P.], seq 2040:2224, ack 1, win 501, length 184
00:25:14.385030 IP 147.182.153.220.22 > 99.227.168.112.60334: Flags [P.], seq 2224:2408, ack 1, win 501, length 184
00:25:14.385085 IP 147.182.153.220.22 > 99.227.168.112.60334: Flags [P.], seq 2408:2548, ack 1, win 501, length 140
00:25:14.385131 IP 147.182.153.220.22 > 99.227.168.112.60334: Flags [P.], seq 2548:2584, ack 1, win 501, length 36
00:25:14.385187 IP 147.182.153.220.22 > 99.227.168.112.60334: Flags [P.], seq 2584:2724, ack 1, win 501, length 140
00:25:14.385229 IP 147.182.153.220.22 > 99.227.168.112.60334: Flags [P.], seq 2724:2760, ack 1, win 501, length 36
00:25:14.398326 IP 99.227.168.112.60334 > 147.182.153.220.22: Flags [.], ack 2760, win 1026, length 0
00:25:14.488358 IP 147.182.153.220.22 > 99.227.168.112.60334: Flags [P.], seq 2760:2916, ack 1, win 501, length 156
00:25:14.488461 IP 147.182.153.220.22 > 99.227.168.112.60334: Flags [P.], seq 2916:3108, ack 1, win 501, length 192
00:25:14.488549 IP 147.182.153.220.22 > 99.227.168.112.60334: Flags [P.], seq 3108:3144, ack 1, win 501, length 36
00:25:14.488564 IP 147.182.153.220.22 > 99.227.168.112.60334: Flags [P.], seq 3144:3292, ack 1, win 501, length 148
00:25:14.488617 IP 147.182.153.220.22 > 99.227.168.112.60334: Flags [P.], seq 3292:3328, ack 1, win 501, length 36
00:25:14.488676 IP 147.182.153.220.22 > 99.227.168.112.60334: Flags [P.], seq 3328:3484, ack 1, win 501, length 156
00:25:14.488721 IP 147.182.153.220.22 > 99.227.168.112.60334: Flags [P.], seq 3484:3520, ack 1, win 501, length 36
00:25:14.488844 IP 147.182.153.220.22 > 99.227.168.112.60334: Flags [P.], seq 3520:3668, ack 1, win 501, length 148
00:25:14.488907 IP 147.182.153.220.22 > 99.227.168.112.60334: Flags [P.], seq 3668:3704, ack 1, win 501, length 36
00:25:14.488964 IP 147.182.153.220.22 > 99.227.168.112.60334: Flags [P.], seq 3704:3860, ack 1, win 501, length 156
00:25:14.489029 IP 147.182.153.220.22 > 99.227.168.112.60334: Flags [P.], seq 3860:3896, ack 1, win 501, length 36
00:25:14.489071 IP 147.182.153.220.22 > 99.227.168.112.60334: Flags [P.], seq 3896:4044, ack 1, win 501, length 148
00:25:14.489132 IP 147.182.153.220.22 > 99.227.168.112.60334: Flags [P.], seq 4044:4236, ack 1, win 501, length 192
00:25:14.489193 IP 147.182.153.220.22 > 99.227.168.112.60334: Flags [P.], seq 4236:4272, ack 1, win 501, length 36
00:25:14.489206 IP 147.182.153.220.22 > 99.227.168.112.60334: Flags [P.], seq 4272:4420, ack 1, win 501, length 148
00:25:14.489258 IP 147.182.153.220.22 > 99.227.168.112.60334: Flags [P.], seq 4420:4456, ack 1, win 501, length 36
00:25:14.489316 IP 147.182.153.220.22 > 99.227.168.112.60334: Flags [P.], seq 4456:4612, ack 1, win 501, length 156
00:25:14.489366 IP 147.182.153.220.22 > 99.227.168.112.60334: Flags [P.], seq 4612:4648, ack 1, win 501, length 36
00:25:14.489496 IP 147.182.153.220.22 > 99.227.168.112.60334: Flags [P.], seq 4648:4804, ack 1, win 501, length 156
00:25:14.489560 IP 147.182.153.220.22 > 99.227.168.112.60334: Flags [P.], seq 4804:4840, ack 1, win 501, length 36
00:25:14.489596 IP 147.182.153.220.22 > 99.227.168.112.60334: Flags [P.], seq 4840:4996, ack 1, win 501, length 156
00:25:14.489631 IP 147.182.153.220.22 > 99.227.168.112.60334: Flags [P.], seq 4996:5032, ack 1, win 501, length 36
00:25:14.489681 IP 147.182.153.220.22 > 99.227.168.112.60334: Flags [P.], seq 5032:5180, ack 1, win 501, length 148
00:25:14.489749 IP 147.182.153.220.22 > 99.227.168.112.60334: Flags [P.], seq 5180:5216, ack 1, win 501, length 36
00:25:14.489793 IP 147.182.153.220.22 > 99.227.168.112.60334: Flags [P.], seq 5216:5372, ack 1, win 501, length 156
00:25:14.489830 IP 147.182.153.220.22 > 99.227.168.112.60334: Flags [P.], seq 5372:5408, ack 1, win 501, length 36
00:25:14.489880 IP 147.182.153.220.22 > 99.227.168.112.60334: Flags [P.], seq 5408:5556, ack 1, win 501, length 148
00:25:14.489938 IP 147.182.153.220.22 > 99.227.168.112.60334: Flags [P.], seq 5556:5732, ack 1, win 501, length 176
00:25:14.489998 IP 147.182.153.220.22 > 99.227.168.112.60334: Flags [P.], seq 5732:5768, ack 1, win 501, length 36
00:25:14.545550 IP 99.227.168.112.60334 > 147.182.153.220.22: Flags [.], ack 3484, win 1023, length 0
00:25:14.545550 IP 99.227.168.112.60334 > 147.182.153.220.22: Flags [.], ack 5768, win 1026, length 0
^C
60 packets captured
105 packets received by filter
0 packets dropped by kernel